Product Name,Sku,Facility,Stock,Cost Price,Avg Cost Price,Mrp,Selling Price
Maharaja Whiteline Mark 1 Happiness 450-Watt Juicer Mixer Grinder (White and Red),Maha-White-Mark-1-Hap-450-W-JMG-Wht-Red,Defective001,1,0,0,0,0
Bajaj GX 3701 750 Watts Mixer Grinder with 3 Jars (Black),Baj-Gx-3701-750-W-3-Jar-Blk,Defective001,2,0,0,0,0
"Pigeon by Stovekraft Non-Stick Biriyani Pot with Lid, 4 litres",Pig-Stv-Non-Stk-Biri-Pot-4-L,Defective001,1,0,0,0,0
Philips HP8143/00 Hair Dryer (Pink),Phi-HP-8143-Hai-Dry-Pink,Defective001,1,0,0,0,0
Morphy Richards 60 RCSS 60-Litre Oven Toaster Grill (Black/Silver),Mor-Ric-60-RCS-OTG-Blk-Sil,Defective001,1,0,0,0,0
Panasonic KX-TSC62SXW Corded Telephone,Pan-KX-TSC62-SXW-Cod-Tel,Defective001,1,0,0,0,0
Gasnova 4 Burber Gas Stove,15566,Defective001,1,0,0,0,0
Lifelong power pro mixer grinder 500 watt Blue,LLMG20,Defective001,1,0,0,0,0
Realme Buds Air Neo Bluetooth True Wireless Headset (White),Real-buds-air-neo-blu-tru-wir-hea-Wht,Defective001,9,0,0,0,0
Wonderchef Nutri blend compact food processor Black only Jars,154545,Defective001,1,0,0,0,0
Pigeon by Stovekraft Favourite 1800-Watt Induction Cooktop,Pig-Stv-Fav-1800-w-Ind-Cook,Defective001,2,0,0,0,0
Shubh Ganga Mixer Grinder,12356,Defective001,1,0,0,0,0
"Prestige Omega Select Plus Non-Stick Omni Tawa, 25cm",30709,Defective001,1,0,0,0,0
Wahl NIS Cordless Clipper,Wahl-NIS-Cord-Clip-Blk,Defective001,1,0,0,0,0
HTC CT-103 Professional Hair Clipper | Trimmer White,HTC-CT-103-Hai-Clip-Wht,Defective001,2,0,0,0,0
Borg classic kitchen machine 600w,155558,Defective001,1,0,0,0,0
Maharani hard coat cookware non-stick fry pan,Mah-har-coa-cook-non-stic-fruy-pan,Defective001,1,0,0,0,0
Toshiba Taffy Mixer Grinder,Tos-taff-mix-grn,Defective001,1,0,0,0,0
Prestige Stylo Plus Mixer Grinder 550 W,41376,Defective001,1,0,0,0,0
Bluemix mixer grinder 550 W,Blue-mix-grn-550-w,Defective001,1,0,0,0,0
LG Stainless Steel Pressure Cooker 3 Litre,LG-SS-Pre-Cok-3-Lit,Defective001,1,0,0,0,0
Usha 29L (OTGW 3629R) Oven Toaster Grill (Wine & Matte Black),USH-29L-OTG-WIN-MAT-BLK,Defective001,1,0,0,0,0
"Vivo V20 2021 (Sunset Melody, 8GB RAM, 128GB ROM) Without Offers",VIV-V20-SUN-MEL-8-128-GB,Defective001,1,0,0,0,0
Pigeon Glory mixer grinder 550W White Blue,125556256,Defective001,1,0,0,0,0
"Pigeon by Stovekraft Non-Stick Kadai,150 with SS Lid - Dia 19.7cm",Pig-stv-Non-Stk-kad-150-mm-Dia-19-cm,Defective001,1,0,0,0,0
Wonderchef Nutri-Blend CKM) with 3 Jars only 400W - Red,15551,Defective001,1,0,0,0,0
